Name,Year,Watched Date,Ratings,Rewatch,Letterboxd URI,Genre,Director,Cast,Mood,Country,Languages,TMDB ID,Actors,Runtime,IMDb Rating,Plot,Language
The Grey,2011.0,12/1/2019,3.5,,https://boxd.it/6OPokp,"Action, Adventure, Drama",Joe Carnahan,,,"United States, United Kingdom",,,"Liam Neeson, Dermot Mulroney, Frank Grillo",117 min,6.7,"After their plane crashes in Alaska, six oil workers are led by a skilled huntsman to survival, but a pack of merciless wolves haunts their every step.","English, Spanish"
Practical Magic,1998.0,12/2/2019,3.5,,https://boxd.it/6OPokf,"Comedy, Drama, Fantasy",Griffin Dunne,,,United States,,,"Sandra Bullock, Nicole Kidman, Stockard Channing",104 min,6.4,"Two witch sisters, raised by their eccentric aunts in a small town, face closed-minded prejudice and a curse which threatens to prevent them ever finding lasting love.",English
Moulin Rouge!,2001.0,12/3/2019,4.0,,https://boxd.it/6OPok5,"Drama, Musical, Romance",Baz Luhrmann,,,"Australia, United States",,,"Nicole Kidman, Ewan McGregor, John Leguizamo",127 min,7.6,A poor Bohemian poet in 1890s Paris falls for a beautiful courtesan and nightclub star coveted by a jealous duke.,"English, French, Spanish"
Black Mountain Side,2014.0,12/8/2019,3.0,,https://boxd.it/6OPojV,"Drama, Horror, Mystery",Nick Szostakiwskyj,,,Canada,,,"Shane Twerdun, Michael Dickson, Carl Toftfelt",99 min,5.1,"At a cold, desolate, northmost outpost in Canada, an archaeological discovery is made. A specialist arrives Nov. 1. Strange things happen. All contact with the outside world is down.",English
Oldboy,2003.0,12/10/2019,4.0,,https://boxd.it/6OPojB,"Action, Drama, Mystery",Park Chan-wook,,,South Korea,,,"Choi Min-sik, Yoo Ji-tae, Kang Hye-jeong",120 min,8.3,"After being kidnapped and imprisoned for fifteen years, Oh Dae-Su is released, only to find that he must track down his captor in five days.",Korean
Twister,1996.0,12/10/2019,3.5,,https://boxd.it/6OPojL,"Action, Adventure, Thriller",Jan de Bont,,,United States,,,"Helen Hunt, Bill Paxton, Jami Gertz",113 min,6.6,Two storm chasers on the brink of divorce must work together to create an advanced weather alert system by putting themselves in the cross-hairs of extremely violent tornadoes.,English
Most Beautiful Island,2017.0,12/12/2019,4.0,,https://boxd.it/6OPojh,"Drama, Horror, Thriller",Ana Asensio,,,United States,,,"Ana Asensio, Natasha Romanova, David Little",80 min,5.7,Most Beautiful Island is a chilling portrait of an undocumented young woman's struggle for survival as she finds redemption from a tortured past in a dangerous game.,"English, Spanish, Russian"
Mrs. Fletcher,2019.0,12/15/2019,3.5,,https://boxd.it/6OPoj7,"Comedy, Drama",N/A,,,United States,,,"Kathryn Hahn, Jackson White, Owen Teague",1 min,7.1,A single mom whose son has moved out for college looks to begin a new life on her own.,English
Booksmart,2019.0,12/23/2019,4.0,,https://boxd.it/6OPogx,Comedy,Olivia Wilde,,,United States,,,"Kaitlyn Dever, Beanie Feldstein, Jessica Williams",102 min,7.1,"On the eve of their high-school graduation, two academic superstars and best friends realize they should have worked less and played more. Determined not to fall short of their peers, the girls try to cram four years of fun into o...","English, Mandarin, French, Spanish"
The Queens,2019.0,12/23/2019,4.0,,https://boxd.it/6OPoiD,Comedy,"Mauro Bolognini, Mario Monicelli, Antonio Pietrangeli",,,"Italy, France",,,"Monica Vitti, Enrico Maria Salerno, Claudia Cardinale",110 min,6.0,"Four unrelated short comedies by four different directors. ""Queen Sabina"" chronicles the sexual misadventures of a teenage girl on the road home. ""Queen Armenia"" centers on a self-serving opportunistic gypsy babysitter who uses he...",Italian
Watchmen,2019.0,12/23/2019,4.0,,https://boxd.it/6OPoiX,"Action, Drama, Mystery",Zack Snyder,,,United States,,,"Jackie Earle Haley, Patrick Wilson, Carla Gugino",162 min,7.6,"In a version of 1985 where superheroes exist, the murder of a colleague sends active vigilante Rorschach on the trail of a conspiracy that will change the course of history.",English
Frozen,2010.0,12/29/2019,3.5,,https://boxd.it/6OPogn,"Animation, Adventure, Comedy","Chris Buck, Jennifer Lee",,,United States,,,"Kristen Bell, Idina Menzel, Jonathan Groff",102 min,7.4,"Fearless optimist Anna teams up with rugged mountain man Kristoff and his loyal reindeer Sven in an epic journey to find Anna's sister Elsa, whose icy powers have trapped the kingdom of Arendelle in eternal winter.",English
We've Forgotten More Than We Ever Knew,2016.0,12/30/2019,2.5,,https://boxd.it/6OPogd,"Drama, Sci-Fi",Thomas Woodrow,,,United States,,,"Doug Jones, Louisa Krause, Aaron Stanford",88 min,5.0,"A Man and a Woman wander through a hostile wilderness in a far-away world. One day, they stumble upon a mysterious set of Structures, which will complicate their lives both for good and ill.",English
Enemy,2013.0,12/31/2019,3.5,,https://boxd.it/6OPofz,"Drama, Mystery, Thriller",Denis Villeneuve,,,"Canada, Spain, France",,,"Jake Gyllenhaal, Mélanie Laurent, Sarah Gadon",91 min,6.9,A mild-mannered college professor investigates the life of an actor who looks exactly like him.,English
Inside Llewyn Davis,2013.0,12/31/2019,4.0,,https://boxd.it/6OPofJ,"Drama, Music","Ethan Coen, Joel Coen",,,"United States, United Kingdom, France",,,"Oscar Isaac, Carey Mulligan, John Goodman",104 min,7.4,A week in the life of a young singer as he navigates the Greenwich Village folk scene of 1961.,English
Baazigar,1993.0,12/31/2019,3.5,,https://boxd.it/6OPog3,"Crime, Drama, Musical","Abbas Alibhai Burmawalla, Mastan Alibhai Burmawalla",,,India,,,"Shah Rukh Khan, Kajol, Dalip Tahil",175 min,7.6,"A young man with a vendetta against a business tycoon seduces the man's younger daughter, but she begins to suspect her new lover's connection with her elder sister and his ulterior motive.",Hindi
Beautiful Boy,2018.0,1/1/2020,4.0,,https://boxd.it/6OPofp,"Biography, Drama",Felix van Groeningen,,,United States,,,"Steve Carell, Maura Tierney, Jack Dylan Grazer",120 min,7.4,"A family coping with addiction over many years goes through the heartbreaking and inspiring experience of survival, relapse and recovery.",English
The Peacemaker,1997.0,1/2/2020,3.5,,https://boxd.it/6OPof5,"Action, Crime, Drama",Mimi Leder,,,United States,,,"George Clooney, Nicole Kidman, Marcel Iures",124 min,6.0,A US Army colonel and a civilian woman supervising him must track down stolen Russian nuclear weapons before they're used by terrorists.,"English, Russian, Serbian, Bosnian, Croatian, Polish, German"
Vertical Limit,2000.0,1/2/2020,3.5,,https://boxd.it/6OPoff,"Action, Adventure, Drama",Martin Campbell,,,"Germany, United States",,,"Scott Glenn, Chris O'Donnell, Bill Paxton",124 min,6.0,"A climber must rescue his sister on the peak of K2, the second highest mountain in the world .","English, Urdu"
Tu Chor Main Sipahi,1996.0,1/4/2020,3.5,,https://boxd.it/6OPoeB,"Action, Comedy, Drama",Guddu Dhanoa,,,India,,,"Akshay Kumar, Saif Ali Khan, Tabu",153 min,5.1,A police officer and a master thief join forces in order to free a village from the clutches of an evil landowner.,Hindi
Chernobyl,2019.0,1/4/2020,4.5,,https://boxd.it/6OPoeV,"Drama, History, Thriller",N/A,,,"United States, United Kingdom",,,"Jared Harris, Jessie Buckley, Stellan Skarsgård",330 min,9.3,"In April 1986, the city of Chernobyl in the Soviet Union suffers one of the worst nuclear disasters in the history of mankind. Consequently, many heroes put their lives on the line in the following days, weeks and months.","English, Russian, Ukrainian"
Ad Astra,2019.0,1/6/2020,3.5,,https://boxd.it/6OPoer,"Adventure, Drama, Mystery",James Gray,,,"United States, China, Brazil",,,"Brad Pitt, Tommy Lee Jones, Ruth Negga",123 min,6.5,An astronaut embarks on a space mission to investigate a threat to the universe and uncover the truth about his father who disappeared thirty years ago.,"English, Norwegian"
Once Upon a Time... in Hollywood,2019.0,1/8/2020,3.5,,https://boxd.it/6OPoeh,"Comedy, Drama",Quentin Tarantino,,,"United States, United Kingdom, China",,,"Leonardo DiCaprio, Brad Pitt, Margot Robbie",161 min,7.6,"As Hollywood's Golden Age is winding down during the summer of 1969, television actor Rick Dalton and his stunt double Cliff Booth endeavor to achieve lasting success in Hollywood while meeting several colorful characters along th...","English, Italian, Spanish, German"
John Wick: Chapter 3 – Parabellum,2019.0,1/11/2020,4.0,,https://boxd.it/6OPodX,"Action, Crime, Drama",Chad Stahelski,,,"United States, Morocco, Ukraine, Italy",,,"Keanu Reeves, Halle Berry, Ian McShane",130 min,7.4,"John Wick is on the run after killing a member of the international assassins' guild, and with a $14 million price tag on his head, he is the target of hit men and women everywhere.","English, Russian, Japanese, Indonesian, Mandarin, Italian, Arabic, Latin"
John Wick: Chapter 2,2017.0,1/11/2020,4.0,,https://boxd.it/6OPoe7,"Action, Crime, Thriller",Chad Stahelski,,,"United States, Italy, Hong Kong, Canada",,,"Keanu Reeves, Riccardo Scamarcio, Ian McShane",122 min,7.4,"After returning to the criminal underworld to repay a debt, John Wick discovers that a large bounty has been put on his life.","English, Italian, Russian, American Sign , Hebrew"
The Aeronauts,2019.0,1/12/2020,4.0,,https://boxd.it/6OPodN,"Action, Adventure, Drama",Tom Harper,,,"United Kingdom, United States",,,"Felicity Jones, Eddie Redmayne, Himesh Patel",100 min,6.6,A balloon pilot and a scientist find themselves in a fight for survival while attempting to make discoveries in a gas balloon in the 1860s.,"English, French, Latin"
The Core,2003.0,1/13/2020,2.5,,https://boxd.it/6OPodt,"Action, Adventure, Sci-Fi",Jon Amiel,,,"United Kingdom, France, Italy, United States",,,"Aaron Eckhart, Hilary Swank, Delroy Lindo",135 min,5.5,The only way to save Earth from catastrophe is to drill down to the core and set it spinning again.,English
Only Lovers Left Alive,2013.0,1/13/2020,4.0,,https://boxd.it/6OPodD,"Comedy, Drama, Fantasy",Jim Jarmusch,,,"United Kingdom, Germany, Greece, France",,,"Tilda Swinton, Tom Hiddleston, Mia Wasikowska",123 min,7.2,"A depressed musician reunites with his lover. However, their romance, which has already endured several centuries, is disrupted by the arrival of her uncontrollable younger sister.","English, French, Arabic, Turkish"
The Darkness,2016.0,1/15/2020,3.0,,https://boxd.it/6OPodj,"Horror, Thriller",Greg McLean,,,United States,,,"Kevin Bacon, Radha Mitchell, David Mazouz",92 min,4.5,"A family unknowingly awakens an ancient supernatural entity on a Grand Canyon vacation, and must fight for survival when it follows them home.",English
Leeches,2016.0,1/16/2020,4.0,,https://boxd.it/6OPod9,"Short, Drama",Payal Sethi,,,India,,,"Sherin Bhatt, Preeti Golacha, Sayani Gupta",27 min,7.0,"In the Old City of Hyderabad, Raisa hatches a dangerous plan to save her younger sister from becoming a one-day bride when she finds an archaic remedy that could restore a girl's virginity.",Urdu
Guava Island,2019.0,1/18/2020,4.0,,https://boxd.it/6OPocZ,"Comedy, Drama, Music",Hiro Murai,,,United States,,,"Donald Glover, Rihanna, Letitia Wright",55 min,6.6,"A young musician seeks to hold a festival to liberate the oppressed people of Guava Island, even if only for a day.","English, Spanish"
Main Khiladi Tu Anari,1994.0,1/20/2020,3.0,,https://boxd.it/6OPocF,"Action, Comedy, Drama",Sameer Malkan,,,India,,,"Akshay Kumar, Saif Ali Khan, Shilpa Shetty Kundra",175 min,6.5,A Bombay police officer seeks revenge when his brother is killed by a powerful underworld figure. Things get complicated when a matinee movie idol begins to shadow the policeman so he can research a movie role.,Hindi
At Eternity's Gate,2018.0,1/21/2020,3.5,,https://boxd.it/6OPocv,"Biography, Drama, History",Julian Schnabel,,,"Ireland, Switzerland, United Kingdom, France, United States",,,"Willem Dafoe, Rupert Friend, Oscar Isaac",111 min,6.9,"A look at the life of painter Vincent van Gogh during the time he lived in Arles and Auvers-sur-Oise, France.","English, French"
Chasing Amy,1997.0,1/23/2020,4.0,,https://boxd.it/6OPocl,"Comedy, Drama, Romance",Kevin Smith,,,United States,,,"Ben Affleck, Joey Lauren Adams, Ethan Suplee",113 min,7.2,"Holden and Banky are comic book artists. Everything's going good for them until they meet Alyssa, also a comic book artist. Holden falls for her, but his hopes are crushed when he finds out she's a lesbian.","English, Arabic"
Gully Boy,2019.0,1/26/2020,4.5,,https://boxd.it/6OPo9r,"Drama, Music, Romance",Zoya Akhtar,,,India,,,"Ranveer Singh, Alia Bhatt, Siddhant Chaturvedi",154 min,7.9,A coming-of-age story based on the lives of street rappers in Mumbai.,"Hindi, English"
Lover for a Day,2017.0,1/27/2020,4.0,,https://boxd.it/6OPo9h,Drama,Philippe Garrel,,,France,,,"Éric Caravaca, Esther Garrel, Louise Chevillotte",76 min,6.6,A young woman returns home after the breakdown of a relationship to discover her father is dating a woman her age.,French
The First,2017.0,1/30/2020,4.0,,https://boxd.it/6OPo97,"Drama, Sci-Fi",N/A,,,United States,,,"Sean Penn, Natascha McElhone, LisaGay Hamilton",N/A,6.6,Fictional series to chronicle the effort to send the first crewed mission to Mars.,English
Anna,2019.0,1/31/2020,3.5,,https://boxd.it/6OPo8X,"Action, Thriller",Luc Besson,,,"France, United States, Canada, Russia, Serbia, Guadeloupe",,,"Sasha Luss, Helen Mirren, Luke Evans",118 min,6.7,Beneath Anna Poliatova's striking beauty lies a secret that will unleash her indelible strength and skill to become one of the world's most feared government assassins.,"English, Russian, French, Italian, Dutch"
Red Eye,2005.0,2/13/2020,3.0,,https://boxd.it/6OPo8N,Thriller,Wes Craven,,,United States,,,"Rachel McAdams, Cillian Murphy, Brian Cox",85 min,6.4,"Lisa on her flight to Miami befriends Jackson who turns out to be a terrorist. Holding her hostage, he forces her to help him assassinate the United States Deputy Secretary of Homeland Security.","English, Russian"
The Farewell,2019.0,2/15/2020,4.0,,https://boxd.it/6OPo8D,"Comedy, Drama",Lulu Wang,,,"United States, China",,,"Shuzhen Zhao, Awkwafina, X Mayo",100 min,7.5,"A Chinese family discovers their grandmother has only a short while left to live and decide to keep her in the dark, scheduling a wedding to gather before she dies.","Mandarin, English, Japanese, Italian"
Dil To Pagal Hai,1997.0,2/16/2020,4.0,,https://boxd.it/6OPo8t,"Comedy, Drama, Musical",Yash Chopra,,,India,,,"Shah Rukh Khan, Madhuri Dixit, Karisma Kapoor",180 min,7.0,"A grand musical about three passionate and dreamy characters: Rahul, Pooja and Nisha. Will their dreams come true? Will they find their true love?",Hindi
Parasite,2019.0,2/24/2020,3.5,,https://boxd.it/6OPo8j,"Drama, Thriller",Bong Joon Ho,,,South Korea,,,"Song Kang-ho, Lee Sun-kyun, Cho Yeo-jeong",132 min,8.5,Greed and class discrimination threaten the newly formed symbiotic relationship between the wealthy Park family and the destitute Kim clan.,"Korean, English"
Rocketman,2019.0,3/1/2020,3.5,,https://boxd.it/6OPo89,"Biography, Drama, Music",Dexter Fletcher,,,"United Kingdom, United States",,,"Taron Egerton, Jamie Bell, Richard Madden",121 min,7.3,"The musical fantasy about Elton John's breakthrough years, from his time as a prodigy at the Royal Academy of Music through his influential and enduring musical partnership with Bernie Taupin.",English
"Where'd You Go, Bernadette",2019.0,3/8/2020,3.5,,https://boxd.it/6OPo7Z,"Comedy, Crime, Drama",Richard Linklater,,,United States,,,"Cate Blanchett, Billy Crudup, Emma Nelson",109 min,6.5,A loving mom becomes compelled to reconnect with her creative passions after years of sacrificing herself for her family. Her leap of faith takes her on an epic adventure that jump-starts her life and leads to her triumphant redis...,English
Splice,2009.0,3/9/2020,3.5,,https://boxd.it/6OPo7P,"Horror, Sci-Fi",Vincenzo Natali,,,"Canada, France, United States",,,"Adrien Brody, Sarah Polley, Delphine Chanéac",104 min,5.8,Genetic engineers Clive Nicoli and Elsa Kast hope to achieve fame by successfully splicing together the DNA of different animals to create new hybrid animals for medical use.,"English, French"
Karuthukalai Pathivu Sei,2019.0,3/10/2020,3.5,,https://boxd.it/6OPo7F,Drama,Rahul Paramahamsa,,,India,,,"S.S.R. Aryan, Upasana Rc, Sindhujaavijii",99 min,5.2,A girl befriends a guy through social media and falls in love with him. She travels to Chennai to be with him and quickly realizes the trap laid for her. This story revolves around social media exploitation and how a single girl f...,Tamil
Dark River,2017.0,3/14/2020,3.5,,https://boxd.it/6OPo7v,"Drama, Mystery, Thriller",Clio Barnard,,,United Kingdom,,,"Ruth Wilson, Jonah Russell, Paul Robertson",90 min,5.9,"Following the death of her father, Alice (Ruth Wilson) returns to her home village for the first time in 15 years, to claim the tenancy to the family farm she believes is rightfully hers.",English
Amy,2015.0,3/15/2020,4.0,,https://boxd.it/6OPo7b,"Documentary, Biography, Music",Asif Kapadia,,,United Kingdom,,,"Amy Winehouse, Mitch Winehouse, Mark Ronson",128 min,7.8,Archival footage and personal testimonials present an intimate portrait of the life and career of British singer/songwriter Amy Winehouse.,English
Les Misérables,2012.0,3/15/2020,3.5,,https://boxd.it/6OPo7l,"Drama, Musical, Romance",Tom Hooper,,,"United Kingdom, United States",,,"Hugh Jackman, Russell Crowe, Anne Hathaway",158 min,7.5,"In 19th-century France, Jean Valjean, who, for decades, has been hunted by the ruthless policeman Javert after breaking parole, agrees to care for a factory worker's daughter. The decision changes their lives forever.",English
Uncut Gems,2019.0,3/20/2020,3.5,,https://boxd.it/6OPo71,"Crime, Drama, Thriller","Benny Safdie, Josh Safdie",,,United States,,,"Adam Sandler, Julia Fox, Idina Menzel",135 min,7.4,"With his debts mounting and angry collectors closing in, a fast-talking New York City jeweler risks everything in hope of staying afloat and alive.","English, Hebrew"
6 Underground,2019.0,3/23/2020,3.0,,https://boxd.it/6OPo6R,"Action, Thriller",Michael Bay,,,"United States, Canada, United Arab Emirates, Italy, Hungary",,,"Ryan Reynolds, Mélanie Laurent, Manuel Garcia-Rulfo",128 min,6.1,It follows a group of people who fake their deaths and decide to form a vigilante team in order to stage a coup d'état against a ruthless dictator.,"English, Turkmen, Cantonese, Italian, Spanish, Ukrainian, French"
I Lost My Body,2019.0,3/29/2020,4.5,,https://boxd.it/6OPo6x,"Animation, Drama, Fantasy",Jérémy Clapin,,,"France, United Kingdom, United States",,,"Hakim Faris, Victoire Du Bois, Patrick d'Assumçao",81 min,7.5,"A story of Naoufel, a young man who is in love with Gabrielle. In another part of town, a severed hand escapes from a dissection lab, determined to find its body again.",French
Andhadhun,2018.0,3/29/2020,4.0,,https://boxd.it/6OPo6H,"Crime, Mystery, Thriller",Sriram Raghavan,,,India,,,"Ayushmann Khurrana, Tabu, Radhika Apte",139 min,8.2,"A series of mysterious events change the life of a blind pianist, who must now report a crime that he should technically know nothing of.","Hindi, English"
The Unthinkable,2018.0,4/3/2020,3.5,,https://boxd.it/6OPo6n,"Action, Romance, Sci-Fi",Victor Danell,,,Sweden,,,"Christoffer Nordenrot, Lisa Henni, Jesper Barkselius",129 min,6.0,"Sweden faces a mysterious attack while Alex tries to reunite with his youth love, Anna.",Swedish
Feel Good,2015.0,4/6/2020,4.0,,https://boxd.it/6OPo5J,"Comedy, Drama, Romance",N/A,,,United Kingdom,,,"Mae Martin, Charlotte Ritchie, Phil Burgers",1 min,7.5,"The series follows recovering addict and comedian Mae, who is trying to control the addictive behaviors and intense romanticism that permeate every facet of their life.",English
From Dusk Till Dawn,1996.0,4/6/2020,3.5,,https://boxd.it/6OPo5T,"Action, Crime, Horror",Robert Rodriguez,,,"United States, Mexico",,,"Harvey Keitel, George Clooney, Juliette Lewis",108 min,7.2,"Two criminals and their hostages unknowingly seek temporary refuge in a truck stop populated by vampires, with chaotic results.","English, Spanish"
Pandora,2016.0,4/9/2020,3.0,,https://boxd.it/6OPo5z,"Action, Drama, Thriller",Jeong-woo Park,,,South Korea,,,"Kim Nam-gil, Kim Joo-Hyun, Jung Jin-young",136 min,6.7,The explosion of a nuclear power plant caused by an earthquake leads to a disaster which no one other than its workers can stop from spreading further.,Korean
The Platform,2019.0,4/13/2020,4.0,,https://boxd.it/6OPo3X,"Horror, Mystery, Sci-Fi",Galder Gaztelu-Urrutia,,,Spain,,,"Ivan Massagué, Zorion Eguileor, Antonia San Juan",94 min,7.0,"In a prison where inmates are fed on a descending platform, those on the upper levels take more than their fair share while those below are left to starve on scraps and one man decides to change the system.","Spanish, Italian, Russian"
United 93,2006.0,4/16/2020,3.5,,https://boxd.it/6OPo3D,"Action, Drama, History",Paul Greengrass,,,"United Kingdom, France, United States",,,"David Alan Basche, Olivia Thirlby, Liza Colón-Zayas",111 min,7.6,"A real-time account of the events on United Flight 93, one of the planes hijacked on September 11th, 2001 that crashed near Shanksville, Pennsylvania when passengers foiled the terrorist plot.","English, Arabic, German"
Unorthodox,2020.0,4/16/2020,4.0,,https://boxd.it/6OPo3N,Drama,N/A,,,Germany,,,"Shira Haas, Amit Rahav, Jeff Wilbusch",213 min,8.0,Story of a young ultra-Orthodox Jewish woman who flees her arranged marriage and religious community to start a new life abroad.,"German, English, Yiddish, Arabic, Polish, Russian"
Behind the Curve,2018.0,4/17/2020,4.5,,https://boxd.it/6OPo3t,Documentary,Daniel J. Clark,,,United States,,,"Mark K. Sargent, Patti Sargent, Hannalore Gerling-Dunsmore",96 min,6.5,"Meet real Flat Earthers, a small but growing contingent of people who firmly believe in a conspiracy to suppress the truth that the Earth is flat.",English
Ferris Bueller's Day Off,1986.0,4/19/2020,4.0,,https://boxd.it/6OPo3j,Comedy,John Hughes,,,United States,,,"Matthew Broderick, Alan Ruck, Mia Sara",103 min,7.8,"A brash, cocky high school senior, tired of skipping school to spend a boring day at home, is determined to enjoy an epic day roaring around his favorite Chicago sites, enlisting his best friend and girlfriend to join him on the a...","English, German"
Colette,2018.0,4/25/2020,3.5,,https://boxd.it/6OPo39,"Biography, Drama, History",Wash Westmoreland,,,"United Kingdom, United States, Hungary, Belgium",,,"Keira Knightley, Fiona Shaw, Dominic West",111 min,6.7,"Colette is pushed by her husband to write novels under his name. Upon their success, she fights to make her talents known, challenging gender norms.",English
30 Minutes or Less,2011.0,4/26/2020,3.5,,https://boxd.it/6OPo2Z,"Action, Comedy, Crime",Ruben Fleischer,,,United States,,,"Jesse Eisenberg, Danny McBride, Nick Swardson",83 min,6.0,"Two fledgling criminals kidnap a pizza delivery guy, strap a bomb to his chest, and inform him that he has mere hours to rob a bank or else...","English, German, Spanish"
"As Above, So Below",2014.0,4/27/2020,4.0,,https://boxd.it/6OPo2F,"Adventure, Horror, Mystery",John Erick Dowdle,,,"France, United States",,,"Perdita Weeks, Ben Feldman, Edwin Hodge",93 min,6.3,"When a team of explorers venture into the catacombs that lie beneath the streets of Paris, they uncover the dark secret that lies within this city of the dead.","English, French, Latin, Persian"
The Endless,2017.0,4/27/2020,2.5,,https://boxd.it/6OPo2P,"Horror, Mystery, Sci-Fi","Justin Benson, Aaron Moorhead",,,United States,,,"Aaron Moorhead, Justin Benson, Callie Hernandez",111 min,6.5,"As kids, they escaped a UFO death cult. Now, two adult brothers seek answers after an old videotape surfaces and brings them back to where they began.",English
Freaks,2018.0,5/2/2020,3.5,,https://boxd.it/6OPo2v,"Drama, Horror",Tod Browning,,,United States,,,"Wallace Ford, Leila Hyams, Olga Baclanova",64 min,7.8,"A circus' beautiful trapeze artist Cleopatra agrees to marry Hans the leader of side-show performers, but Hans' deformed friends discover that she is only marrying him for his inheritance. So they seek revenge.","English, German, French"
Into the Night,2020.0,5/5/2020,4.0,,https://boxd.it/6OPo2b,"Drama, Sci-Fi, Thriller",N/A,,,Belgium,,,"Pauline Etienne, Laurent Capelluto, Mehmet Kurtulus",N/A,7.0,"When radiation from the sun causes a global disaster on Earth, survivors on an overnight flight from Brussels race from city to city trying to stay ahead of the sun's rays by remaining in the cover of night.","French, Flemish, English, Italian, Turkish, Arabic, Russian, Bulgarian, Mandarin, Polish"
Frances Ha,2012.0,5/10/2020,4.0,,https://boxd.it/6OPo21,"Comedy, Drama, Romance",Noah Baumbach,,,"United States, Brazil",,,"Greta Gerwig, Mickey Sumner, Adam Driver",86 min,7.4,"A New York woman apprentices for a dance company and throws herself headlong into her dreams, even as the possibility of realizing them dwindles.","English, French"
Manto,2018.0,5/17/2020,4.0,,https://boxd.it/6OPo1R,"Biography, Drama",Nandita Das,,,"India, France, United States",,,"Nawazuddin Siddiqui, Rasika Dugal, Tahir Raj Bhasin",112 min,7.3,The film is a biographical account of writer Saadat Hasan Manto's life and is set in 1940s India.,"Hindi, Urdu"
Klaus,2019.0,5/18/2020,3.5,,https://boxd.it/6OPo1H,"Animation, Adventure, Comedy","Sergio Pablos, Carlos Martínez López",,,"Spain, United Kingdom, United States, Austria, Canada, France",,,"Jason Schwartzman, J.K. Simmons, Rashida Jones",96 min,8.2,"A simple act of kindness always sparks another, even in a frozen, faraway place. When Smeerensburg's new postman, Jesper, befriends toymaker Klaus, their gifts melt an age-old feud and deliver a sleigh full of holiday traditions.","English, Saami"
