Name,Year,Watched Date,Ratings,Rewatch,Letterboxd URI,Genre,Director,Cast,Mood,Country,Languages,TMDB ID,Actors,Runtime,IMDb Rating,Plot,Language
Religulous,2008.0,1/15/2014,4.0,,https://boxd.it/6OPqRv,"Documentary,Comedy,War",Larry Charles,"Bill Maher, Tal Bachman, Jonathan Boulden",,United States,"English,Hebrew,Arabic,Persian,Spanish",,,,,,
Captain Phillips,2013.0,1/16/2014,3.5,,https://boxd.it/6OPqRb,"Action,Biography,Crime",Paul Greengrass,"Tom Hanks, Barkhad Abdi, Barkhad Abdirahman",,"United States,United Kingdom,Malta","English,Somali",,,,,,
We Bought a Zoo,2011.0,2/16/2014,4.0,,https://boxd.it/6OPqR1,"Comedy,Drama,Family",Cameron Crowe,"Matt Damon, Scarlett Johansson, Thomas Haden Church",,United States,"English,Spanish",,,,,,
Gravity,2013.0,2/28/2014,4.0,,https://boxd.it/6OPqQR,"Drama,Sci-Fi,Thriller",Alfonso Cuarón,"Sandra Bullock, George Clooney, Ed Harris",,"United Kingdom,United States","English,Greenlandic",,,,,,
American Hustle,2013.0,3/17/2014,3.5,,https://boxd.it/6OPqOB,"Crime,Drama",David O. Russell,"Christian Bale, Amy Adams, Bradley Cooper",,"United States,China","English,Arabic",,,,,,
Kill Your Darlings,2013.0,3/17/2014,3.0,,https://boxd.it/6OPqOL,"Biography,Drama,Romance",John Krokidas,"Daniel Radcliffe, Dane DeHaan, Michael C. Hall",,United States,English,,,,,,
Fruitvale Station,2013.0,3/17/2014,4.0,,https://boxd.it/6OPqOV,"Biography,Crime,Drama",Ryan Coogler,"Michael B. Jordan, Melonie Diaz, Octavia Spencer",,United States,"English,Spanish",,,,,,
Don Jon,2013.0,3/17/2014,3.0,,https://boxd.it/6OPqQx,"Comedy,Drama,Romance",Joseph Gordon-Levitt,"Joseph Gordon-Levitt, Scarlett Johansson, Julianne Moore",,United States,English,,,,,,
Edward Scissorhands,1990.0,3/17/2014,3.5,,https://boxd.it/6OPqQH,"Drama,Fantasy,Romance",Tim Burton,"Johnny Depp, Winona Ryder, Dianne Wiest",,United States,English,,,,,,
Blue Is the Warmest Color,2013.0,3/23/2014,4.0,,https://boxd.it/6OPqOh,,,,,,,,,,,,
300: Rise of an Empire,2014.0,3/24/2014,3.0,,https://boxd.it/6OPqO7,"Action,Drama,Fantasy",Noam Murro,"Sullivan Stapleton, Eva Green, Lena Headey",,"United States,Bulgaria",English,,,,,,
Malcolm X,1992.0,3/27/2014,4.0,,https://boxd.it/6OPqNX,"Biography,Drama,History",Spike Lee,"Denzel Washington, Angela Bassett, Delroy Lindo",,"Japan,United States","English,Arabic",,,,,,
Children of Heaven,1997.0,3/30/2014,4.0,,https://boxd.it/6OPqNN,"Drama,Family,Sport",Majid Majidi,"Reza Naji, Amir Farrokh Hashemian, Bahare Seddiqi",,Iran,Persian,,,,,,
How to Make Money Selling Drugs,2012.0,4/2/2014,2.5,,https://boxd.it/6OPqNj,"Documentary,Crime",Matthew Cooke,"'Freeway' Ricky Ross, Susan Sarandon, David Simon",,United States,English,,,,,,
August: Osage County,2013.0,4/2/2014,4.0,,https://boxd.it/6OPqNt,"Comedy,Drama",John Wells,"Meryl Streep, Dermot Mulroney, Julia Roberts",,United States,English,,,,,,
Robot & Frank,2012.0,4/2/2014,3.0,,https://boxd.it/6OPqND,"Comedy,Crime,Drama",Jake Schreier,"Peter Sarsgaard, Frank Langella, Susan Sarandon",,United States,English,,,,,,
Noah,2014.0,4/8/2014,3.0,,https://boxd.it/6OPqMP,"Action,Adventure,Drama",Darren Aronofsky,"Russell Crowe, Jennifer Connelly, Anthony Hopkins",,United States,English,,,,,,
Black Swan,2010.0,4/8/2014,3.5,,https://boxd.it/6OPqMZ,"Drama,Thriller",Darren Aronofsky,"Natalie Portman, Mila Kunis, Vincent Cassel",,United States,"English,French,Italian",,,,,,
The Great Gatsby,2013.0,4/8/2014,3.0,,https://boxd.it/6OPqN9,"Drama,Romance",Baz Luhrmann,"Leonardo DiCaprio, Carey Mulligan, Joel Edgerton",,"Australia,United States",English,,,,,,
Perfect Sense,2011.0,4/9/2014,4.0,,https://boxd.it/6OPqMF,"Drama,Romance,Sci-Fi",David Mackenzie,"Ewan McGregor, Eva Green, Lauren Tempany",,"United Kingdom,Sweden,Denmark,Ireland","English,Sign",,,,,,
Mud,2012.0,4/16/2014,4.0,,https://boxd.it/6OPqMv,"Adventure,Drama",Jeff Nichols,"Matthew McConaughey, Tye Sheridan, Jacob Lofland",,United States,English,,,,,,
A Good Year,2006.0,4/18/2014,3.5,,https://boxd.it/6OPqMl,"Comedy,Drama,Romance",Ridley Scott,"Russell Crowe, Abbie Cornish, Albert Finney",,"United States,United Kingdom","English,French,Russian",,,,,,
Dog Day Afternoon,1975.0,4/20/2014,3.5,,https://boxd.it/6OPqMb,"Biography,Crime,Drama",Sidney Lumet,"Al Pacino, John Cazale, Penelope Allen",,United States,English,,,,,,
Ratatouille,2007.0,4/26/2014,5.0,,https://boxd.it/6OPqM1,"Animation,Adventure,Comedy","Brad Bird, Jan Pinkava","Brad Garrett, Lou Romano, Patton Oswalt",,"United States,France","English,French",,,,,,
Dawn of the Dead,2004.0,4/30/2014,3.5,,https://boxd.it/6OPqLH,"Action,Horror",Zack Snyder,"Sarah Polley, Ving Rhames, Mekhi Phifer",,"United States,Canada,Japan,France",English,,,,,,
Zombieland,2009.0,4/30/2014,3.5,,https://boxd.it/6OPqLR,"Action,Comedy,Horror",Ruben Fleischer,"Jesse Eisenberg, Emma Stone, Woody Harrelson",,United States,"English,Spanish,French",,,,,,
The Arrested Development Documentary Project,2013.0,5/6/2014,4.0,,https://boxd.it/6OPqLx,"Documentary,Comedy",Jeff Smith,"John Amodeo, Will Arnett, Scott Baio",,United States,English,,,,,,
Snowpiercer,2013.0,6/7/2014,3.5,,https://boxd.it/6OPqLd,"Action,Sci-Fi,Thriller",Bong Joon Ho,"Chris Evans, Jamie Bell, Tilda Swinton",,"South Korea,Czech Republic","English,Korean,French,Japanese,Czech,German",,,,,,
The Bang Bang Club,2010.0,6/7/2014,3.5,,https://boxd.it/6OPqLn,"Biography,Drama,History",Steven Silver,"Ryan Phillippe, Malin Akerman, Taylor Kitsch",,"Canada,South Africa","English,Zulu,Xhosa,Afrikaans",,,,,,
Armour of God,1986.0,6/8/2014,3.0,,https://boxd.it/6OPqIX,"Action,Adventure,Comedy","Jackie Chan, Eric Tsang","Jackie Chan, Alan Tam, Lola Forner",,"Hong Kong,Yugoslavia","Cantonese,English",,,,,,
Lone Survivor,2013.0,6/8/2014,4.0,,https://boxd.it/6OPqJ7,"Documentary,History",,Chris Caracci,,United States,English,,,,,,
Fargo,1996.0,6/8/2014,4.5,,https://boxd.it/6OPqL3,"Crime,Drama,Thriller","Joel Coen, Ethan Coen","William H. Macy, Frances McDormand, Steve Buscemi",,"United Kingdom,United States",English,,,,,,
Non-Stop,2014.0,6/16/2014,3.5,,https://boxd.it/6OPqIN,"Action,Mystery,Thriller",Jaume Collet-Serra,"Liam Neeson, Julianne Moore, Scoot McNairy",,"United Kingdom,France,Canada,United States","English,German",,,,,,
Water,2005.0,6/29/2014,3.5,,https://boxd.it/6OPqID,Drama,Deepa Mehta,"Lisa Ray, John Abraham, Seema Biswas",,"Canada,United States,India","Hindi,Sanskrit,English",,,,,,
Gandhi,1982.0,7/10/2014,4.0,,https://boxd.it/6OPqIj,"Biography,Drama,History",Richard Attenborough,"Ben Kingsley, John Gielgud, Rohini Hattangadi",,"United Kingdom,India","English,Hindi",,,,,,
Dawn of the Planet of the Apes,2014.0,7/10/2014,4.0,,https://boxd.it/6OPqIt,"Action,Adventure,Drama",Matt Reeves,"Gary Oldman, Keri Russell, Andy Serkis",,"United States,United Kingdom,Canada","English,American Sign",,,,,,
Safe House,2012.0,7/19/2014,3.0,,https://boxd.it/6OPqHZ,"Action,Thriller",Daniel Espinosa,"Denzel Washington, Ryan Reynolds, Robert Patrick",,"Japan,United States,South Africa","English,Afrikaans",,,,,,
The Grand Budapest Hotel,2014.0,7/19/2014,3.5,,https://boxd.it/6OPqI9,"Comedy,Drama",Wes Anderson,"Ralph Fiennes, F. Murray Abraham, Mathieu Amalric",,"United States,Germany","English,French,German",,,,,,
Saving Mr. Banks,2013.0,7/23/2014,3.5,,https://boxd.it/6OPqHv,"Biography,Comedy,Drama",John Lee Hancock,"Emma Thompson, Tom Hanks, Annie Rose Buckley",,"Australia,United Kingdom,United States",English,,,,,,
Stuck in Love,2012.0,7/23/2014,3.5,,https://boxd.it/6OPqHF,"Comedy,Drama,Romance",Josh Boone,"Greg Kinnear, Jennifer Connelly, Lily Collins",,United States,English,,,,,,
Nebraska,2013.0,7/23/2014,4.0,,https://boxd.it/6OPqHP,Drama,Alexander Payne,"Bruce Dern, Will Forte, June Squibb",,United States,"English,Spanish",,,,,,
Thor: The Dark World,2013.0,8/2/2014,3.5,,https://boxd.it/6OPqHl,"Action,Adventure,Fantasy",Alan Taylor,"Chris Hemsworth, Natalie Portman, Tom Hiddleston",,"United States,Iceland",English,,,,,,
Short Term 12,2013.0,8/3/2014,4.5,,https://boxd.it/6OPqGH,Drama,Destin Daniel Cretton,"Brie Larson, Frantz Turner, John Gallagher Jr.",,United States,"English,Spanish",,,,,,
Her,2013.0,8/3/2014,4.0,,https://boxd.it/6OPqGR,"Drama,Romance",Ned Benson,"Jessica Chastain, James McAvoy, Nina Arianda",,United States,English,,,,,,
The Amazing Spider-Man 2,2014.0,8/3/2014,2.5,,https://boxd.it/6OPqHb,"Action,Adventure,Sci-Fi",Marc Webb,"Andrew Garfield, Emma Stone, Jamie Foxx",,United States,English,,,,,,
Beauty and the Beast,1991.0,8/7/2014,3.5,,https://boxd.it/6OPqGd,"Animation,Family,Fantasy","Gary Trousdale, Kirk Wise","Paige O'Hara, Robby Benson, Jesse Corti",,"United States,Japan","English,French",,,,,,
Despicable Me 2,2013.0,8/7/2014,3.5,,https://boxd.it/6OPqGn,"Animation,Adventure,Comedy","Pierre Coffin, Chris Renaud","Steve Carell, Kristen Wiig, Benjamin Bratt",,"United States,France,Japan","English,Ukrainian",,,,,,
Cloudy with a Chance of Meatballs 2,2013.0,8/7/2014,2.0,,https://boxd.it/6OPqGx,"Animation,Adventure,Comedy","Cody Cameron, Kris Pearn","Bill Hader, Anna Faris, Will Forte",,"United States,Canada","English,Chinese",,,,,,
28 Days Later,2002.0,8/11/2014,3.5,,https://boxd.it/6OPqFT,"Drama,Horror,Sci-Fi",Danny Boyle,"Cillian Murphy, Naomie Harris, Christopher Eccleston",,"United Kingdom,United States","English,Spanish,Finnish",,,,,,
The Mist,2007.0,8/11/2014,3.5,,https://boxd.it/6OPqG3,"Horror,Sci-Fi,Thriller",Frank Darabont,"Thomas Jane, Marcia Gay Harden, Laurie Holden",,United States,English,,,,,,
Divergent,2014.0,8/15/2014,3.5,,https://boxd.it/6OPqFJ,"Action,Adventure,Drama",Neil Burger,"Shailene Woodley, Theo James, Kate Winslet",,United States,"English,Spanish",,,,,,
Philomena,2013.0,8/16/2014,3.5,,https://boxd.it/6OPqFz,"Biography,Comedy,Drama",Stephen Frears,"Judi Dench, Steve Coogan, Sophie Kennedy Clark",,"United Kingdom,France,United States",English,,,,,,
Howl,2010.0,8/19/2014,3.5,,https://boxd.it/6OPqFp,"Biography,Drama,Romance","Rob Epstein, Jeffrey Friedman","James Franco, Todd Rotondi, Jon Prescott",,United States,English,,,,,,
Godzilla,2014.0,9/7/2014,2.5,,https://boxd.it/6OPqFf,"Action,Adventure,Sci-Fi",Gareth Edwards,"Aaron Taylor-Johnson, Elizabeth Olsen, Bryan Cranston",,"United States,Japan","English,Japanese",,,,,,
Identity Thief,2013.0,9/13/2014,2.5,,https://boxd.it/6OPqF5,"Comedy,Crime,Drama",Seth Gordon,"Jason Bateman, Melissa McCarthy, John Cho",,United States,"English,Spanish",,,,,,
Edge of Tomorrow,2014.0,9/22/2014,3.5,,https://boxd.it/6OPqCb,"Action,Adventure,Sci-Fi",Doug Liman,"Tom Cruise, Emily Blunt, Bill Paxton",,"United States,Canada,India,Australia",English,,,,,,
Haider,2014.0,10/7/2014,4.0,,https://boxd.it/6OPqC1,"Action,Crime,Drama",Vishal Bhardwaj,"Shahid Kapoor, Tabu, Shraddha Kapoor",,India,Hindi,,,,,,
Begin Again,2013.0,10/12/2014,4.0,,https://boxd.it/6OPqBR,"Comedy,Drama,Music",John Carney,"Keira Knightley, Mark Ruffalo, Adam Levine",,United States,English,,,,,,
Frenzy,1972.0,10/19/2014,3.5,,https://boxd.it/6OPqB3,"Drama,Thriller",Alfred Hitchcock,"Jon Finch, Barry Foster, Barbara Leigh-Hunt",,United Kingdom,English,,,,,,
Wish I Was Here,2014.0,10/19/2014,3.0,,https://boxd.it/6OPqBd,"Comedy,Drama",Zach Braff,"Zach Braff, Joey King, Pierce Gagnon",,United States,English,,,,,,
Elysium,2013.0,10/19/2014,3.0,,https://boxd.it/6OPqBx,"Action,Drama,Sci-Fi",Neill Blomkamp,"Matt Damon, Jodie Foster, Sharlto Copley",,"United States,Canada,South Africa,Mexico","English,Spanish,French,Afrikaans",,,,,,
How to Train Your Dragon 2,2014.0,10/21/2014,3.5,,https://boxd.it/6OPqAT,"Animation,Action,Adventure",Dean DeBlois,"Jay Baruchel, Cate Blanchett, Gerard Butler",,"United States,India",English,,,,,,
Shame,2011.0,10/22/2014,3.5,,https://boxd.it/6OPqAJ,Drama,Steve McQueen,"Michael Fassbender, Carey Mulligan, James Badge Dale",,"United Kingdom,Canada,United States",English,,,,,,
Contraband,2012.0,10/23/2014,3.0,,https://boxd.it/6OPqAz,"Action,Adventure,Crime",Baltasar Kormákur,"Mark Wahlberg, Giovanni Ribisi, Kate Beckinsale",,"United Kingdom,France,United States","English,Spanish",,,,,,
Drunken Master,1978.0,10/25/2014,3.5,,https://boxd.it/6OPqAp,"Action,Comedy",Yuen Woo-Ping,"Jackie Chan, Siu-Tin Yuen, Jeong-lee Hwang",,Hong Kong,"Cantonese,Mandarin",,,,,,
My Neighbor Totoro,1988.0,10/26/2014,4.0,,https://boxd.it/6OPqAf,"Animation,Adventure,Comedy",Hayao Miyazaki,"Hitoshi Takagi, Noriko Hidaka, Chika Sakamoto",,Japan,Japanese,,,,,,
X-Men: Days of Future Past,2014.0,10/28/2014,4.0,,https://boxd.it/6OPqzB,"Action,Adventure,Sci-Fi",Bryan Singer,"Patrick Stewart, Ian McKellen, Hugh Jackman",,"United Kingdom,United States,Canada","English,Vietnamese,French,Russian",,,,,,
This Is the End,2013.0,10/28/2014,3.0,,https://boxd.it/6OPqzL,"Comedy,Fantasy,Sci-Fi","Evan Goldberg, Seth Rogen","James Franco, Jonah Hill, Seth Rogen",,United States,"English,Spanish",,,,,,
22 Jump Street,2014.0,10/28/2014,3.5,,https://boxd.it/6OPqzV,"Action,Comedy,Crime","Phil Lord, Christopher Miller","Channing Tatum, Jonah Hill, Ice Cube",,United States,"English,Spanish,Ukrainian",,,,,,
Exit Through the Gift Shop,2010.0,10/28/2014,4.0,,https://boxd.it/6OPqA5,"Documentary,Comedy,Crime",Banksy,"Banksy, Mr. Brainwash, Space Invader",,"United Kingdom,France","English,French",,,,,,
The One I Love,2014.0,10/31/2014,4.0,,https://boxd.it/6OPqyj,"Comedy,Drama,Fantasy",Charlie McDowell,"Mark Duplass, Elisabeth Moss, Ted Danson",,United States,English,,,,,,
Bhaag Milkha Bhaag,2013.0,10/31/2014,3.0,,https://boxd.it/6OPqyt,"Biography,Drama,Sport",Rakeysh Omprakash Mehra,"Farhan Akhtar, Kousi Orfahli, Deepak Singh Rawat",,India,Hindi,,,,,,
Kaminey,2009.0,10/31/2014,4.0,,https://boxd.it/6OPqyD,"Action,Crime,Drama",Vishal Bhardwaj,"Shahid Kapoor, Priyanka Chopra Jonas, Deb Mukherjee",,India,"Hindi,Marathi,Bengali,English,Portuguese",,,,,,
Pulp Fiction,1994.0,10/31/2014,4.0,,https://boxd.it/6OPqyX,"Crime,Drama",Quentin Tarantino,"John Travolta, Uma Thurman, Samuel L. Jackson",,United States,"English,Spanish,French",,,,,,
Chak De! India,2007.0,10/31/2014,3.5,,https://boxd.it/6OPqzh,"Drama,Family,Sport",Shimit Amin,"Shah Rukh Khan, Vidya Malvade, Sagarika Ghatge",,"India,United States,United Kingdom,Australia","Hindi,English",,,,,,
The Hurt Locker,2008.0,10/31/2014,4.0,,https://boxd.it/6OPqzr,"Drama, Thriller, War",Kathryn Bigelow,,,"United States, Luxembourg, Canada",,,"Jeremy Renner, Anthony Mackie, Brian Geraghty",131 min,7.5,"During the Iraq War, a Sergeant recently assigned to an army bomb squad is put at odds with his squad mates due to his maverick way of handling his work.","English, Arabic"
Let's Be Cops,2014.0,11/9/2014,2.5,,https://boxd.it/6OPqy9,"Action,Comedy,Crime",Luke Greenfield,"Jake Johnson, Damon Wayans Jr., Rob Riggle",,United States,"English,Spanish",,,,,,
In Bruges,2008.0,11/12/2014,4.0,,https://boxd.it/6OPqxZ,"Comedy,Crime,Drama",Martin McDonagh,"Colin Farrell, Brendan Gleeson, Ciarán Hinds",,"United Kingdom,United States",English,,,,,,
Stoker,2013.0,11/16/2014,3.0,,https://boxd.it/6OPqxP,"Drama,Mystery,Thriller",Park Chan-wook,"Mia Wasikowska, Nicole Kidman, Matthew Goode",,"United Kingdom,United States","English,French,Italian",,,,,,
Zindagi Na Milegi Dobara,2011.0,11/29/2014,4.0,,https://boxd.it/6OPqxF,"Comedy,Drama,Musical",Zoya Akhtar,"Hrithik Roshan, Farhan Akhtar, Abhay Deol",,India,Hindi,,,,,,
Black Hawk Down,2001.0,12/12/2014,4.0,,https://boxd.it/6OPqvJ,Short,,"Mark Bowden, Jerry Bruckheimer, Andrew Collins, Josh Hartnett",,UK,English,,,,,,
Breathless,1960.0,12/12/2014,3.5,,https://boxd.it/6OPqvT,"Crime, Drama",Jean-Luc Godard,,,France,,,"Jean-Paul Belmondo, Jean Seberg, Jean-Luc Godard",90 min,7.6,"A small-time crook, hunted by the authorities for a car theft and the murder of a police officer, attempts to persuade a hip American journalism student to run away with him to Italy.","French, English"
Rumble in the Bronx,1995.0,12/12/2014,3.5,,https://boxd.it/6OPqw3,"Action,Comedy,Crime",Stanley Tong,"Jackie Chan, Anita Mui, Françoise Yip",,Hong Kong,"English,Cantonese",,,,,,
Gone Girl,2014.0,12/14/2014,4.5,,https://boxd.it/6OPqvf,"Drama,Mystery,Thriller",David Fincher,"Ben Affleck, Rosamund Pike, Neil Patrick Harris",,United States,English,,,,,,
Wheels on Meals,1984.0,12/14/2014,3.0,,https://boxd.it/6OPqvp,"Action,Comedy,Crime",Sammo Kam-Bo Hung,"Jackie Chan, Biao Yuen, Sammo Kam-Bo Hung",,Hong Kong,"Cantonese,English",,,,,,
Andaz Apna Apna,1994.0,12/14/2014,4.0,,https://boxd.it/6OPqvz,"Action,Comedy,Romance",Rajkumar Santoshi,"Aamir Khan, Salman Khan, Raveena Tandon",,India,Hindi,,,,,,
Another Earth,2011.0,12/19/2014,2.5,,https://boxd.it/6OPquV,"Drama,Mystery,Romance",Mike Cahill,"Brit Marling, William Mapother, Matthew-Lee Erlbach",,United States,English,,,,,,
The Maze Runner,2014.0,12/19/2014,3.5,,https://boxd.it/6OPqv5,"Action,Mystery,Sci-Fi",Wes Ball,"Dylan O'Brien, Kaya Scodelario, Will Poulter",,"United States,United Kingdom",English,,,,,,
Never Let Me Go,2010.0,12/20/2014,3.5,,https://boxd.it/6OPquh,"Drama,Romance",Mark Romanek,"Carey Mulligan, Andrew Garfield, Izzy Meikle-Small",,"United Kingdom,United States",English,,,,,,
Lagaan: Once Upon a Time in India,2001.0,12/20/2014,4.0,,https://boxd.it/6OPqur,"Drama,Musical,Sport",Ashutosh Gowariker,"Aamir Khan, Raghubir Yadav, Gracy Singh",,"India,United States","Hindi,English",,,,,,
Kingdom of Heaven,2005.0,12/20/2014,2.5,,https://boxd.it/6OPquB,"Action,Adventure,Drama",Ridley Scott,"Orlando Bloom, Eva Green, Liam Neeson",,"United Kingdom,Germany,Spain,Morocco,United States,Italy,France","English,Arabic,Latin,Italian,German",,,,,,
Rang De Basanti,2006.0,12/20/2014,4.5,,https://boxd.it/6OPquL,"Comedy,Crime,Drama",Rakeysh Omprakash Mehra,"Aamir Khan, Soha Ali Khan, Siddharth",,India,Hindi,,,,,,
The Hobbit: The Desolation of Smaug,2013.0,12/22/2014,3.5,,https://boxd.it/6OPqu7,"Adventure,Fantasy",Peter Jackson,"Ian McKellen, Martin Freeman, Richard Armitage",,"New Zealand,United States",English,,,,,,
The Hobbit: The Battle of the Five Armies,2014.0,12/24/2014,4.0,,https://boxd.it/6OPqtX,"Adventure,Fantasy",Peter Jackson,"Ian McKellen, Martin Freeman, Richard Armitage",,"New Zealand,United States",English,,,,,,
Nothing to Lose,1997.0,12/27/2014,3.5,,https://boxd.it/6OPqtN,"Action,Adventure,Comedy",Steve Oedekerk,"Martin Lawrence, Tim Robbins, John C. McGinley",,United States,English,,,,,,
She's the Man,2006.0,12/29/2014,2.5,,https://boxd.it/6OPqtD,"Comedy,Romance,Sport",Andy Fickman,"Amanda Bynes, Channing Tatum, Laura Ramsey",,United States,"English,French",,,,,,
I Origins,2014.0,1/2/2015,4.0,,https://boxd.it/6OPqtj,"Drama,Mystery,Romance",Mike Cahill,"Michael Pitt, Steven Yeun, Astrid Bergès-Frisbey",,United States,"English,Hindi",,,,,,
The Bone Collector,1999.0,1/2/2015,3.5,,https://boxd.it/6OPqtt,"Crime,Drama,Mystery",Phillip Noyce,"Denzel Washington, Angelina Jolie, Queen Latifah",,United States,English,,,,,,
The Secret Life of Walter Mitty,2013.0,1/6/2015,4.0,,https://boxd.it/6OPqt9,"Adventure,Comedy,Drama",Ben Stiller,"Ben Stiller, Kristen Wiig, Jon Daly",,"United States,United Kingdom","English,Spanish,Icelandic",,,,,,
Twins,1988.0,1/8/2015,3.0,,https://boxd.it/6OPqsP,"Comedy,Crime",Ivan Reitman,"Arnold Schwarzenegger, Danny DeVito, Kelly Preston",,United States,English,,,,,,
The Great Dictator,1940.0,1/8/2015,3.0,,https://boxd.it/6OPqsZ,"Comedy,Drama,War",Charles Chaplin,"Charles Chaplin, Paulette Goddard, Jack Oakie",,United States,"English,Esperanto,Latin",,,,,,
Bicycle Thieves,1948.0,1/9/2015,4.0,,https://boxd.it/6OPqsF,Drama,Vittorio De Sica,"Lamberto Maggiorani, Enzo Staiola, Lianella Carell",,Italy,"Italian,German",,,,,,
Ghost Ship,2002.0,1/10/2015,3.0,,https://boxd.it/6OPqsv,"Horror,Mystery,Thriller",Steve Beck,"Julianna Margulies, Gabriel Byrne, Ron Eldard",,"United States,Australia","English,Italian,Spanish",,,,,,
Untraceable,2008.0,1/14/2015,3.5,,https://boxd.it/6OPqsb,"Crime,Mystery,Thriller",Gregory Hoblit,"Diane Lane, Colin Hanks, Joseph Cross",,United States,English,,,,,,
The 400 Blows,1959.0,1/16/2015,3.5,,https://boxd.it/6OPqqT,"Crime,Drama",François Truffaut,"Jean-Pierre Léaud, Albert Rémy, Claire Maurier",,France,"French,English",,,,,,
The Good Lie,2014.0,1/21/2015,3.0,,https://boxd.it/6OPqqz,"Biography,Drama",Philippe Falardeau,"Reese Witherspoon, Arnold Oceng, Ger Duany",,"Kenya,India,United States,Canada,South Africa",English,,,,,,
Nightcrawler,2014.0,1/31/2015,4.0,,https://boxd.it/6OPqqp,"Crime,Drama,Thriller",Dan Gilroy,"Jake Gyllenhaal, Rene Russo, Bill Paxton",,United States,English,,,,,,
American Sniper,2014.0,2/5/2015,3.5,,https://boxd.it/6OPqq5,"Action, Biography, Drama",Clint Eastwood,,,United States,,,"Bradley Cooper, Sienna Miller, Kyle Gallner",133 min,7.3,"Navy S.E.A.L. sniper Chris Kyle's pinpoint accuracy saves countless lives on the battlefield and turns him into a legend. Back home with his family after four tours of duty, however, Chris finds that it is the war he can't leave b...","English, Arabic"
Psycho,1960.0,2/5/2015,4.0,,https://boxd.it/6OPqqf,"Drama,Horror,Mystery",Alfred Hitchcock,"Anthony Perkins, Janet Leigh, Vera Miles",,United States,English,,,,,,
Paperman,2012.0,2/6/2015,4.0,,https://boxd.it/6OPqpV,"Animation,Short,Comedy",John Kahrs,"John Kahrs, Kari Wahlgren, Jack Goldenberg",,"United States,Japan",English,,,,,,
Big Hero 6,2014.0,2/7/2015,4.0,,https://boxd.it/6OPqpL,"Animation,Action,Adventure","Don Hall, Chris Williams","Ryan Potter, Scott Adsit, Jamie Chung",,United States,English,,,,,,
The Theory of Everything,2014.0,2/8/2015,3.5,,https://boxd.it/6OPqpr,"Biography,Drama,Romance",James Marsh,"Eddie Redmayne, Felicity Jones, Tom Prior",,"United Kingdom,Japan,United States","English,French,Ukrainian",,,,,,
Sholay,1975.0,2/8/2015,3.5,,https://boxd.it/6OPqpB,"Action,Adventure,Comedy",Ramesh Sippy,"Sanjeev Kumar, Dharmendra, Amitabh Bachchan",,India,Hindi,,,,,,
Whiplash,2014.0,2/9/2015,4.5,,https://boxd.it/6OPqph,"Drama,Music",Damien Chazelle,"Miles Teller, J.K. Simmons, Melissa Benoist",,United States,English,,,,,,
Traitor,2008.0,2/17/2015,3.5,,https://boxd.it/6OPqp7,"Action,Crime,Drama",Jeffrey Nachmanoff,"Don Cheadle, Guy Pearce, Archie Panjabi",,United States,"English,Arabic",,,,,,
The Imitation Game,2014.0,2/23/2015,4.0,,https://boxd.it/6OPqoX,"Biography,Drama,Thriller",Morten Tyldum,"Benedict Cumberbatch, Keira Knightley, Matthew Goode",,United States,"English,German",,,,,,
Fury,2014.0,2/25/2015,4.0,,https://boxd.it/6OPqoN,"Action,Drama,War",David Ayer,"Brad Pitt, Shia LaBeouf, Logan Lerman",,"United States,China,United Kingdom","English,German",,,,,,
Police Story,1985.0,2/27/2015,4.0,,https://boxd.it/6OPqoj,"Action,Comedy,Crime",Jackie Chan,"Jackie Chan, Maggie Cheung, Brigitte Lin",,Hong Kong,Cantonese,,,,,,
Harishchandrachi Factory,2009.0,2/27/2015,4.0,,https://boxd.it/6OPqot,"Biography,Comedy,Drama",Paresh Mokashi,"Nandu Madhav, Vibhawari Deshpande, Atharva Karve",,India,Marathi,,,,,,
Modern Times,1936.0,3/2/2015,3.5,,https://boxd.it/6OPqo9,"Comedy,Drama,Romance",Charles Chaplin,"Charles Chaplin, Paulette Goddard, Henry Bergman",,United States,English,,,,,,
Breach,2007.0,3/8/2015,3.0,,https://boxd.it/6OPqnZ,"Biography,Crime,Drama",Billy Ray,"Chris Cooper, Ryan Phillippe, Dennis Haysbert",,United States,"English,Russian,Arabic,Latin",,,,,,
Kingsman: The Secret Service,2014.0,3/11/2015,4.0,,https://boxd.it/6OPqnP,"Action, Adventure, Comedy",Matthew Vaughn,,,"United Kingdom, United States",,,"Colin Firth, Taron Egerton, Samuel L. Jackson",129 min,7.7,"A spy organisation recruits a promising street kid into the agency's training program, while a global threat emerges from a twisted tech genius.","English, Arabic, Swedish"
Police Story 2,1988.0,3/14/2015,3.5,,https://boxd.it/6OPqnF,"Action,Comedy,Crime",Jackie Chan,"Jackie Chan, Maggie Cheung, Kwok-Hung Lam",,Hong Kong,"Cantonese,English",,,,,,
Predestination,2014.0,3/16/2015,3.5,,https://boxd.it/6OPqnv,"Action,Drama,Sci-Fi","Michael Spierig, Peter Spierig","Ethan Hawke, Sarah Snook, Noah Taylor",,"Australia,United States",English,,,,,,
Hachi: A Dog's Tale,2009.0,3/20/2015,3.5,,https://boxd.it/6OPqnl,"Biography,Drama,Family",Lasse Hallström,"Richard Gere, Joan Allen, Cary-Hiroyuki Tagawa",,"United Kingdom,United States","English,Japanese",,,,,,
Le Samouraï,1967.0,3/21/2015,4.5,,https://boxd.it/6OPqnb,"Crime,Drama,Thriller",Jean-Pierre Melville,"Alain Delon, François Périer, Nathalie Delon",,"France,Italy",French,,,,,,
Rashomon,1950.0,3/22/2015,4.0,,https://boxd.it/6OPqn1,"Crime,Drama,Mystery",Akira Kurosawa,"Toshirô Mifune, Machiko Kyô, Masayuki Mori",,Japan,Japanese,,,,,,
Guardians of the Galaxy,2014.0,3/23/2015,4.0,,https://boxd.it/6OPqmR,"Action,Adventure,Comedy",James Gunn,"Chris Pratt, Vin Diesel, Bradley Cooper",,"United States,United Kingdom",English,,,,,,
Penguins of Madagascar,2014.0,3/24/2015,4.0,,https://boxd.it/6OPqmH,"Animation,Action,Adventure","Eric Darnell, Simon J. Smith","Tom McGrath, Chris Miller, Christopher Knights",,"United States,Australia,India,Japan,Finland","English,Italian,Mandarin,Spanish,Armenian",,,,,,
Wild,2014.0,3/26/2015,3.5,,https://boxd.it/6OPqlJ,"Adventure,Biography,Drama",Jean-Marc Vallée,"Reese Witherspoon, Laura Dern, Gaby Hoffmann",,United States,English,,,,,,
Anger Management,2003.0,3/26/2015,2.5,,https://boxd.it/6OPqlT,Comedy,Peter Segal,"Jack Nicholson, Adam Sandler, Marisa Tomei",,United States,English,,,,,,
The Abyss,1989.0,3/27/2015,3.5,,https://boxd.it/6OPql5,"Adventure,Drama,Mystery",James Cameron,"Ed Harris, Mary Elizabeth Mastrantonio, Michael Biehn",,United States,English,,,,,,
Schindler's List,1993.0,3/27/2015,4.5,,https://boxd.it/6OPqlf,"Documentary,Short",,,,United States,English,,,,,,
Police Story 3: Super Cop,1992.0,3/27/2015,3.5,,https://boxd.it/6OPqlz,,,,,,,,,,,,
Traffic,2000.0,3/28/2015,4.0,,https://boxd.it/6OPqkV,"Crime,Drama,Thriller",Steven Soderbergh,"Michael Douglas, Benicio Del Toro, Catherine Zeta-Jones",,"Germany,United States","English,Spanish",,,,,,
